date,title,amount,funded,inst,researchers
2023-2026,Mapping school buildings using sensory ethnographic methods: A district-wide study of school architecture and spatial justice,"$246,051","granted 1/17/2023",Spencer Foundation Large Grant,"co-Pis: Elizabeth de Freitas, Laura Kurgan, and **Matthew X. Curinga**"
2020,BLAST: Bilingual Language Assessment and Skills Tracker,"$50,000","granted, winter cohort",National Science Foundation I-Corps,"Rocio Raña (technical lead), Evgeniya Maryutina (entrepennerial lead), **Matthew X. Curinga** (industry mentor) "
2015,Computational number sense in middle school mathematics: Creative approaches to algorithmic problem solving,"$835,008",unfunded,National Science Foundation,"co-Pis: Elizabeth de Freitas, Lee Stemkoski, **Matthew X. Curinga**, Dominic Klyve, Rebecca Rufo-Tepper"
2015,"Algorithms, accountability and the ethics of education research: Interrogating digital research methods","$34,800",unfunded,AERA Educational Research Conference Proposal,"co-Pis: Elizabeth de Freitas (chair), **Matthew X. Curinga**, Stephanie Daza, Ezekiel Dixon-Román, & Patti Lather"
2013,Mobile Cases for Peer-to-peer learning,"$1,500,000",unfunded,Institute for Educational Studies,Pi: **Matthew X. Curinga**
2011-2012,Robotics for Programming,"$1,380",granted 2/21/11,Adelphi University Instructional Technology Grant,Pi: **Matthew X. Curinga**
,Wikiotics Design Research,"$3,440",granted 2/2/11,Adelphi University Faculty Development Grant,Pi: **Matthew X. Curinga**
