date,title,link,note,role
2018,Peer Challenge,/software.html#PeerChallenge,mobile app to support peer-to-peer, case-based learning,Lead programmer 
2014-present,PyTutor,/software.html#PyTutor,a social tutoring/peer-learning approach to online computer science education.,Lead developer/architect.
2010-2014,Wikiotics,/software.html#Wikiotics,Free/Open language learning wiki.,Instructional design, curriculum development, software architecture.
2009-2010,Brainscape,/software.html#Brainscape,Mobile & Web Study Platform,Lead developer
2002-2008,RewardTV,/software.html#RewardTV,Gamified Media/Market Research Platform,Lead programmer
1999-2002,mLogic,/software.html#Crisp,Crisp Wireless' mobile media authoring platform,Co-founder &amp;Chief Technical Officer
1997-1999,RunTime,#,Web Content Management System,Software engineer